"Port","Service","Common Risk"
"53","DNS","DNS spoofing, cache poisoning, amplification DoS attacks."
"80","HTTP","Vulnerable to web exploits (e.g., injection, XSS)."
"443","HTTPS","Relatively secure if using proper TLS config; vulnerabilities possible in web apps."
"135","MSRPC","Used for Windows RPC; often targeted for remote exploits."
"139","NetBIOS-SSN","Can expose Windows shares; risk of information leaks."
"445","Microsoft-DS","Used for SMB (file sharing); exploited in ransomware attacks (e.g., WannaCry)."
"1521","Oracle DB","Risky if exposed; unauthorized access or data leaks."
"3306","MySQL","Risk of unauthorized database access if not secure."